<?xml version="1.0" encoding="UTF-8"?>
<?xml-stylesheet type="text/xsl" href="service.xsl"?>
<service xmlns:xsi="http://www.w3.org/2001/XMLSchema-instance"
xsi:noNamespaceSchemaLocation="service.xsd"> 
	
	<booking>
		<id>1256513</id>
		<category>Stoles</category>
		<size>S-M</size>
		<brand>Zara</brand>
		<instock>Yes</instock>
		<contact>2020-08-20</contact>
		

	</booking>
<booking>
		<id>1257845</id>
		<category>Skirts</category>
		<size>S-L</size>
		<brand>Gucci</brand>
		<instock>Yes</instock>
		<contact>2020-08-20</contact>

	</booking>
	<booking>
		<id>1256534</id>
		<category>Shrugs</category>
		<size>S-L</size>
		<brand>Code</brand>
		<instock>Yes</instock>
		<contact>2020-08-998</contact>

	</booking>
	<booking>
		<id>1256513</id>
		<category>Jackets</category>
		<size>S-XL</size>
		<brand>In-Store</brand>
		<instock>Yes</instock>
		<contact>2020-08-20</contact>

	</booking>
	
</service>